CRN,Subj,Num,Sec,Title,Hours,Faculty,Days,Beg,End,Days.2,Beg.2,End.2,Location,Limit,Enr,Av.Seats,Additional.Info,General.Education
American Studies,,NA,,,,,,NA,NA,,NA,NA,,NA,NA,,,NA
10294,AMST,333,A,Junior Seminar,4,W Register/J Grammer,W,1400,1630,,NA,NA,Stirlings ,25,10,Available: 15,Writing Intensive; Instructor permission required,NA
10391,ANTH,307,A,The Archaeology of Southeastern United States,4,M McCollough,W,1530,1830,,NA,NA,Woods Laboratories 301,15,4,Available: 11,Prerequisite: ANTH 106,NA
10576,ARTH,348,A,Reframing Architecture and the Decorative Arts: Arts and Crafts, Art Nouveau, and Art Deco,4,M Oba,TR,1300,1415,,NA,NA,Carnegie Hall 302,20,1,Available: 19,Prerequisites: ARTH 104 or HUMN 202,NA
10307,EDUC,279,A,History of American Education,4,W Register,MW,1100,1215,,NA,NA,St. Luke's 214,20,23,Closed,,NA
10607,ENGL,378,A,American Literature II,4,E Grammer,TR,1100,1215,,NA,NA,St. Luke's 112,25,23,Available: 2,,NA
10608,ENGL,379,A,The American Novel,4,T Carlson,TR,1400,1515,,NA,NA,duPont Library 215,15,13,Available: 2,Writing Intensive,NA
10691,ENGL,396,A,American Environmental Literature,4,J Gatta,MWF,900,950,,NA,NA,Walsh-Ellett Hall 302,25,19,Available: 6,,NA
10625,HIST,202,A,History of the United States II,4,C Israel,MWF,1100,1150,,NA,NA,Walsh-Ellett Hall 308,25,24,Available: 1,,NA
10628,HIST,226,A,Politics and Society in Contemporary America,4,W Register,TR,930,1045,,NA,NA,Walsh-Ellett Hall 306,25,23,Available: 2,,NA
10629,HIST,227,A,Intellectual and Cultural History of the United States I,4,H Roberson,TR,1300,1415,,NA,NA,Walsh-Ellett Hall 206,25,23,Available: 2,,NA
10632,HIST,279,A,History of American Education,4,W Register,MW,1100,1215,,NA,NA,St. Luke's 214,20,23,Closed,,NA
10635,HIST,329,A,The New South,4,C Israel,TR,1100,1215,,NA,NA,St. Luke's 100,15,15,Closed,Waitlist - contact instructor,NA
10637,HIST,347,A,The American Civil Rights Movement,4,H Roberson,M,1400,1630,,NA,NA,Walsh-Ellett Hall 208,15,15,Closed,Writing Intensive,NA
10412,POLS,203,A,The Presidency,4,C Brockett,MW,1100,1215,,NA,NA,Walsh-Ellett Hall 210,35,35,Closed,,NA
10416,POLS,332,A,Contemporary Constitutional Law,4,R Pearigen,TR,930,1045,,NA,NA,Walsh-Ellett Hall 210,25,25,Closed,Instructor permission required,NA
10491,POLS,373,A,African-American Political Thought,4,G McKeen,TR,1100,1215,,NA,NA,Walsh-Ellett Hall 312,25,11,Available: 14,,NA
10421,POLS,390,A,The United Nations,4,E Dunn,MW,1100,1215,,NA,NA,Walsh-Ellett Hall 208,25,9,Available: 16,,NA
10559,RELG,391,A,Southern Religion,4,J Smith,MWF,1000,1050,,NA,NA,duPont Library G31,14,28,Closed,,NA
Anthropology,,NA,,,,,,NA,NA,,NA,NA,,NA,NA,,,NA
10382,ANTH,104,A,Introductory Cultural Anthropology,4,R O'Connor,MWF,900,950,,NA,NA,Woods Laboratories 342,20,20,Closed,Reserved Seats: sophomores-6 (none available), returning freshmen-8 (none available),NA
10383,ANTH,104,B,Introductory Cultural Anthropology,4,R O'Connor,MWF,1000,1050,,NA,NA,Woods Laboratories 342,20,22,Closed,Reserved Seats: sophomores-6 (none available), returning freshmen-8 (none available),NA
10384,ANTH,104,C,Introductory Cultural Anthropology,4,C Ray,MWF,1100,1150,,NA,NA,Woods Laboratories 342,20,22,Closed,Reserved Seats: sophomores-6 (1 available), returning freshmen-10 (none available),NA
10385,ANTH,104,D,Introductory Cultural Anthropology,4,C Ray,MWF,1200,1250,,NA,NA,Woods Laboratories 342,20,22,Closed,Reserved Seats: sophomores-5 (none available), returning freshmen-8 (none available),NA
10386,ANTH,107,A,Human Evolution and Variation,4,D Murdock,TR,800,915,,NA,NA,Woods Laboratories 342,20,20,Closed,Reserved Seats: sophomores-6 (1 available), returning freshmen-10 (none available),NA
10393,ANTH,201,A,Global Problems: Anthropology and Contemporary Issues,4,W Leggett,TR,1300,1415,,NA,NA,Woods Laboratories 342,18,21,Closed,,NA
10390,ANTH,202,A,World Prehistory,4,C Ray,MW,1400,1515,,NA,NA,Woods Laboratories 230,20,22,Closed,Reserved Seats: sophomores-5 (none available), returning freshmen-5 (none available),NA
10391,ANTH,307,A,The Archaeology of Southeastern United States,4,M McCollough,W,1530,1830,,NA,NA,Woods Laboratories 301,15,4,Available: 11,Prerequisite: ANTH 106,NA
10392,ANTH,310,A,Topics in Archaeology and Historic Preservation,4,M McCollough,TBA,NA,NA,,NA,NA,TBA,15,0,Available: 15,Prerequisites: ANTH 106 and (ANTH 307 or ANTH 309 or ANTH 313); Instructor permission required,NA
10681,ANTH,317,A,The Anthropology of Development,4,D Murdock,TR,1100,1215,,NA,NA,Woods Laboratories 342,15,14,Available: 1,Prerequisite: ANTH 104,NA
10682,ANTH,342,A,Southeast Asia: An Introduction through Literature,4,R Kipp,R,1330,1600,,NA,NA,Woods Laboratories 103,16,7,Available: 9,Prerequisite: ANTH 104,NA
10388,ANTH,390,A,Social Theory,4,J Hamer,TR,930,1045,,NA,NA,Woods Laboratories 342,15,11,Available: 4,,NA
10387,ANTH,402,A,Senior Seminar,4,D Murdock,M,1300,1530,,NA,NA,Woods Laboratories 342,15,6,Available: 9,,NA
Art and Art History,,NA,,,,,,NA,NA,,NA,NA,,NA,NA,,,NA
10581,ART,103,A,Introduction to Lens and Time-based Media,4,P Malde,TR,1100,1215,M,1400,1630,duPont Library G31,15,16,Closed,Instructor permission required; Studio Art Fee-Malde: $100,NA
10683,ART,104,A,Introduction to Three- and Four-Dimensional Media,4,G Pond,W,1330,1630,,NA,NA,duPont Library G26,15,16,Closed,Instructor permission required; Priority given to ArtS majors and first-year students; Studio Art Fee-Malde: $115,NA
10712,ART,105,A,Introduction to Painting and Drawing Processes and Theory,4,E Carlos,F,1300,1700,,NA,NA,Carnegie Hall 201,15,15,Closed,Reserved Seats: returning freshmen-5 (none available),NA
10582,ART,251,A,Intermediate Drawing,4,E Carlos,R,1300,1700,,NA,NA,Carnegie Hall 201,15,14,Available: 1,Prerequisite: ART 151,NA
10711,ART,263,A,Documentary Studies in Lens and Time Based Media,4,P Malde,R,1400,1630,,NA,NA,duPont Library G31,15,10,Available: 5,Prerequisites: ART 103 or ART 131,NA
10679,ART,281,A,Intermediate Sculpture,4,G Pond,R,1330,1630,,NA,NA,Dairy Sculpture Studio ,6,6,Closed,Prerequisite: ART 181; Sculpture Fee: $175,NA
10583,ART,351,A,Advanced Drawing,4,E Carlos,R,1300,1700,,NA,NA,Carnegie Hall 201,15,2,Available: 13,Prerequisite: ART 251,NA
10680,ART,381,A,Advanced Sculpture,4,G Pond,R,1330,1630,,NA,NA,Dairy Sculpture Studio ,6,0,Available: 6,Prerequisite: ART 281; Sculpture Fee: $175,NA
10684,ART,416,A,Symbolizing the Self,4,C Bucklow,F,1400,1630,,NA,NA,Carnegie Hall 304,15,9,Available: 6,,NA
10748,ART,419,A,Junior Tutorial in Art-II,4,P Malde,T,1330,1630,,NA,NA,Carnegie Hall 306,25,8,Available: 17,Open only to juniors pursuing majors in art,NA
10578,ART,430,A,Senior Seminar,4,G Pond,T,1330,1630,,NA,NA,Carnegie Hall 306,25,14,Available: 11,Writing Intensive; Open only to seniors pursuing majors in art,NA
10685,ART,432,A,Directed Projects with Visiting Artists,4,C Bucklow,W,1400,1630,,NA,NA,Carnegie Hall 304,15,6,Available: 9,Open only to students pursuing majors in art,NA
10570,ARTH,103,A,Survey of Western Art I,4,G Clark,MW,1100,1215,,NA,NA,Carnegie Hall 302,20,23,Closed,Reserved Seats: seniors-5 (none available), juniors-5 (none available), sophomores-5 (none available), returning freshmen-5 (none available); Waitlist - contact instructor,NA
10574,ARTH,104,A,Survey of Western Art II,4,M Brennecke,MWF,1000,1050,,NA,NA,Carnegie Hall 306,20,20,Closed,,NA
10575,ARTH,104,B,Survey of Western Art II,4,M Brennecke,MWF,1100,1150,,NA,NA,Carnegie Hall 306,20,22,Closed,,NA
10332,ARTH,107,A,The Films of Alfred Hitchcock,4,L Richardson,TR,1100,1215,,NA,NA,duPont Library G26,15,20,Closed,Instructor permission required,NA
10579,ARTH,317,A,Junior Seminar,4,C Mansfield,M,1400,1630,,NA,NA,Carnegie Hall 304,10,10,Closed,Writing Intensive; ArtH majors & minors only,NA
10580,ARTH,317,B,Junior Seminar,4,C Mansfield,T,1400,1630,,NA,NA,Carnegie Hall 304,10,8,Available: 2,Writing Intensive; ArtH majors & minors only,NA
10571,ARTH,326,A,Northern Renaissance Art,4,G Clark,TR,930,1045,,NA,NA,Carnegie Hall 302,20,18,Available: 2,Prerequisites: ARTH 103 or ARTH 104 or HUMN 102,NA
10572,ARTH,326,B,Northern Renaissance Art,4,G Clark,TR,1100,1215,,NA,NA,Carnegie Hall 302,20,21,Closed,Prerequisites: ARTH 103 or ARTH 104 or HUMN 102; Waitlist - contact instructor,NA
10573,ARTH,335,A,Nineteenth-Century Art,4,M Brennecke,TR,930,1045,,NA,NA,Carnegie Hall 306,20,18,Available: 2,Prerequisites: ARTH 104 or HUMN 202,NA
10576,ARTH,348,A,Reframing Architecture and the Decorative Arts: Arts and Crafts, Art Nouveau, and Art Deco,4,M Oba,TR,1300,1415,,NA,NA,Carnegie Hall 302,20,1,Available: 19,Prerequisites: ARTH 104 or HUMN 202,NA
Asian Studies,,NA,,,,,,NA,NA,,NA,NA,,NA,NA,,,NA
10682,ANTH,342,A,Southeast Asia: An Introduction through Literature,4,R Kipp,R,1330,1600,,NA,NA,Woods Laboratories 103,16,7,Available: 9,Prerequisite: ANTH 104,NA
10315,ASIA,100,A,Introduction to Asian Studies,4,J Oba,TR,1100,1215,,NA,NA,St. Luke's 214,25,25,Closed,,NA
10686,ASIA,204,A,Introduction to Contemporary Chinese Cinema,4,J Xiao,T,1300,1530,,NA,NA,St. Luke's 214,25,26,Closed,,NA
10311,CHIN,104,A,Elementary Chinese II,4,J Xiao,MW,900,950,TR,930,1020,Guerry Hall 205,15,4,Available: 11,Prerequisite: CHIN 103,NA
10312,CHIN,301,A,Advanced Chinese,4,J Xiao,MW,1400,1450,R,1400,1450,Guerry Hall 205,15,6,Available: 9,Prerequisite: CHIN 203,NA
10536,ECON,309,A,Women in the Economy,4,Y Mohiuddin,R,1400,1630,,NA,NA,Walsh-Ellett Hall 306,20,20,Closed,Writing Intensive; Prerequisite: ECON 101,NA
10627,HIST,212,A,History of China and East Asia II,4,H Goldberg,TR,930,1045,,NA,NA,Walsh-Ellett Hall 308,25,27,Closed,,NA
10313,JAPN,104,A,Elementary Japanese II,4,M Oba,MWF,1000,1050,R,1500,1550,Guerry Hall 204,15,7,Available: 8,Prerequisite: JAPN 103,NA
10314,JAPN,301,A,Composition and Conversation,4,M Oba,MWF,1100,1150,,NA,NA,Guerry Hall 131,15,5,Available: 10,Prerequisite: JAPN 203,NA
10687,MUSC,211,A,“Songs of the Caged, Songs of the Free”: Music, Place, and Identity in Asian Diasporas,4,J Oba,TR,930,1045,,NA,NA,St. Luke's 214,20,9,Available: 11,Prerequisites: ASIA 100 or MUSC 101 or MUSC 105,NA
10565,PHIL,215,A,Chinese Philosophy,4,J Peterman,MF,1100,1215,,NA,NA,St. Luke's 210,20,19,Available: 1,,NA
10419,POLS,360,A,Chinese Politics,4,D Waller,W,1400,1630,,NA,NA,St. Luke's 100,25,16,Available: 9,,NA
10555,RELG,162,A,Introduction to Asian Religions,4,S Brown,MWF,900,950,,NA,NA,Walsh-Ellett Hall 204,22,24,Closed,Waitlist - contact instructor,NA
10556,RELG,162,B,Introduction to Asian Religions,4,S Brown,MWF,1100,1150,,NA,NA,Walsh-Ellett Hall 204,22,22,Closed,Reserved Seats: sophomores-10 (1 available), returning freshmen-12 (2 available); Waitlist - contact instructor,NA
Biology,,NA,,,,,,NA,NA,,NA,NA,,NA,NA,,,NA
10340,BIOL,105,A,Biology and People,4,N Berner,TR,800,915,,NA,NA,Woods Laboratories 216,20,20,Closed,Non-Lab Science,NA
10341,BIOL,105,B,Biology and People,4,N Berner,MWF,800,850,,NA,NA,Woods Laboratories 113,20,19,Available: 1,Non-Lab Science,NA
10688,BIOL,107,A,People and the Environment,4,D McGrath,TR,1100,1215,,NA,NA,Woods Laboratories 113,20,22,Closed,Non-Lab Science,NA
10342,BIOL,131,A,Evolution, Ecology and Biodiversity (Lab),0,D McGrath,MWF,900,950,W,1330,1630,Woods Laboratories 113,20,20,Closed,Lab Science,NA
10343,BIOL,131,B,Evolution, Ecology and Biodiversity (Lab),0,K Zigler,MWF,1000,1050,R,1330,1630,Woods Laboratories 113,20,19,Available: 1,Lab Science,NA
10344,BIOL,132,A,Cellular, Molecular and Physiological Biology (Lab),0,J Palisano/N Berner,MWF,1100,1150,M,1330,1630,Woods Laboratories 113,20,19,Available: 1,Lab Science,NA
10345,BIOL,132,B,Cellular, Molecular and Physiological Biology (Lab),0,J Palisano/L Jones,MWF,1100,1150,T,1330,1630,Woods Laboratories 113,20,16,Available: 4,Lab Science,NA
10346,BIOL,201,A,Ornithology (Lab),4,D Haskell,MWF,800,850,M,1330,1630,Woods Laboratories 103,16,17,Closed,Lab Science; Prerequisites: BIOL 131 or BIOL 132,NA
10347,BIOL,209,A,Advanced Conservation Biology,4,J Evans,TR,1100,1215,,NA,NA,Woods Laboratories 103,16,17,Closed,Non-Lab Science; Prerequisite: BIOL 131,NA
10348,BIOL,220,A,The Molecular Revolution in Medicine (Lab),4,H Croom,TR,930,1045,W,1330,1630,Woods Laboratories 103,16,13,Available: 3,Lab Science; Prerequisite: BIOL 132,NA
10689,BIOL,303,A,Applied Biological Statistics,4,C Butler,TR,930,1045,,NA,NA,Woods Laboratories G9,10,3,Available: 7,Non-Lab Science; Prerequisite: STAT 204,NA
10349,BIOL,306,A,Biochemistry,4,H Croom,MWF,1100,1150,,NA,NA,Woods Laboratories 103,16,11,Available: 5,Non-Lab Science; Prerequisites: BIOL 132 and CHEM 201,NA
10705,BIOL,334,A,Developmental Biology,4,K Zigler,TR,1100,1215,,NA,NA,Woods Laboratories 121,16,9,Available: 7,Non-Lab Science; Prerequisites: BIOL 131 and BIOL 132,NA
10351,BIOL,340,A,Microbiology (Lab),4,J Palisano,MWF,900,950,T,1330,1630,Woods Laboratories 103,16,12,Available: 4,Lab Science,NA
10700,BIOL,341,A,GIS and Ecology (Lab),4,C Butler,TR,800,915,R,1330,1630,Woods Laboratories G9,10,4,Available: 6,Lab Science; Prerequisite: BIOL 131,NA
Chemistry,,NA,,,,,,NA,NA,,NA,NA,,NA,NA,,,NA
10474,CHEM,102,A,General Chemistry II (Lab),4,R Bachman,MWF,900,950,,NA,NA,Woods Laboratories BLACKMAN,30,10,Available: 20,Lab Science; Prerequisite: CHEM 101,NA
10475,CHEM,102,B,General Chemistry II (Lab),4,E Kirven,MWF,1000,1050,,NA,NA,Woods Laboratories BLACKMAN,30,21,Available: 9,Lab Science; Prerequisite: CHEM 101,NA
10476,CHEM,102,L1,General Chemistry II (Lab),0,R Summers,M,1330,1630,,NA,NA,Woods Laboratories 202,20,10,Available: 10,Lab Science; Prerequisite: CHEM 101,NA
10477,CHEM,102,L2,General Chemistry II (Lab),0,R Summers,T,1330,1630,,NA,NA,Woods Laboratories 202,20,14,Available: 6,Lab Science; Prerequisite: CHEM 101,NA
10478,CHEM,102,L3,General Chemistry II (Lab),0,E Kirven,W,1330,1630,,NA,NA,Woods Laboratories 202,20,7,Available: 13,Lab Science; Prerequisite: CHEM 101,NA
10479,CHEM,108,A,Chemistry and Art (Lab),4,J Bordley,TR,930,1045,M,1330,1630,Woods Laboratories BLACKMAN,20,30,Closed,Lab Science; Not offered Easter 2006,NA
10480,CHEM,202,A,Organic Chemistry II (Lab),4,K Walsh,MWF,800,850,,NA,NA,Woods Laboratories 216,42,29,Available: 13,Lab Science; Prerequisite: CHEM 201,NA
10481,CHEM,202,L1,Organic Chemistry II (Lab),0,E Kirven,M,1330,1630,,NA,NA,Woods Laboratories 205,14,7,Available: 7,Lab Science; Prerequisite: CHEM 201,NA
10482,CHEM,202,L2,Organic Chemistry II (Lab),0,K Walsh,T,1330,1630,,NA,NA,Woods Laboratories 205,14,11,Available: 3,Lab Science; Prerequisite: CHEM 201,NA
10483,CHEM,202,L3,Organic Chemistry II (Lab),0,K Walsh,W,1330,1630,,NA,NA,Woods Laboratories 205,14,11,Available: 3,Lab Science; Prerequisite: CHEM 201,NA
10484,CHEM,301,A,Junior Seminar,2,D Miles,F,1330,1430,,NA,NA,Woods Laboratories 216,10,6,Available: 4,Non-Lab Science; Open only to juniors pursuing majors in chemistry,NA
10485,CHEM,306,A,Biochemistry,4,H Croom,MWF,1100,1150,,NA,NA,Woods Laboratories 103,16,11,Available: 5,Non-Lab Science; Prerequisites: CHEM 201 and BIOL 132,NA
10486,CHEM,308,A,Inorganic Chemistry (Lab),4,R Bachman,MWF,1000,1050,T,1330,1630,Woods Laboratories 216,20,5,Available: 15,Lab Science; Pre- or Corequisite: CHEM 202,NA
10487,CHEM,311,A,Chemical Analysis (Lab),4,D Miles,MWF,900,950,R,1330,1630,Woods Laboratories 216,20,6,Available: 14,Lab Science; Prerequisite: CHEM 102,NA
10488,CHEM,401,A,Senior Seminar,2,D Miles,F,1330,1430,,NA,NA,Woods Laboratories 216,10,2,Available: 8,Non-Lab Science; Open only to seniors pursuing majors in chemistry,NA
10489,CHEM,417,A,Advanced Biochemistry,4,R Summers,TR,1100,1215,,NA,NA,Woods Laboratories 217,20,4,Available: 16,Non-Lab Science; Prerequisites: (BIOL 306 or CHEM 306) or CHEM 307,NA
10490,CHEM,422,A,Quantum Chemistry and Spectroscopy,4,J Bordley,TR,1100,1215,,NA,NA,Woods Laboratories 216,20,5,Available: 15,Non-Lab Science; Prerequisites: PHYS 101 and MATH 102 and (CHEM 111 or CHEM 102),NA
Classics,,NA,,,,,,NA,NA,,NA,NA,,NA,NA,,,NA
10303,CLST,101,A,Classical Mythology,4,J Bruss,MWF,1100,1150,,NA,NA,St. Luke's 112,30,29,Available: 1,,NA
10301,GREK,104,A,Elementary Greek II,4,J Bruss,MWF,900,950,R,1300,1350,St. Luke's 104,15,3,Available: 12,Prerequisite: GREK 103,NA
10747,GREK,401,A,Greek Tragedy I,4,J Bruss,T,1215,1330,F,1215,1330,St. Luke's 104,15,7,Available: 8,Prerequisite: GREK 301,NA
10296,LATN,104,A,Elementary Latin II,4,C McDonough,MWF,1100,1150,T,1300,1350,St. Luke's 202,25,19,Available: 6,Prerequisite: LATN 103,NA
10297,LATN,203,A,Intermediate Latin,4,D Seiters,TR,1100,1215,M,1230,1320,Walsh-Ellett Hall 202,25,18,Available: 7,Prerequisite: LATN 104,NA
10298,LATN,301,A,Introduction to Latin Epic,4,D Seiters,TR,800,915,,NA,NA,St. Luke's 112,25,22,Available: 3,Prerequisite: LATN 203,NA
10299,LATN,309,A,Roman Historians II,4,C McDonough,TR,930,1045,,NA,NA,St. Luke's 100,20,11,Available: 9,Prerequisite: LATN 301,NA
10300,LATN,401,A,Roman Drama I,4,D Seiters,MWF,1100,1150,,NA,NA,St. Luke's 104,20,11,Available: 9,Prerequisite: LATN 301,NA
Computer Science,,NA,,,,,,NA,NA,,NA,NA,,NA,NA,,,NA
10426,CSCI,157,A,Introduction to Programming,4,S Carl/L Dale,TR,930,1045,R,1300,1600,Woods Laboratories 136,15,10,Available: 5,,NA
10427,CSCI,257,A,Data Structures,4,S Carl,MWF,1000,1050,,NA,NA,Woods Laboratories 136,15,4,Available: 11,Prerequisite: CSCI 157,NA
10428,CSCI,326,A,Functional Programming,4,S Carl,MWF,1100,1150,,NA,NA,Woods Laboratories 136,15,5,Available: 10,Prerequisite: CSCI 257,NA
10429,CSCI,348,A,Databases,4,L Dale,MWF,900,950,,NA,NA,Woods Laboratories 136,15,5,Available: 10,Prerequisites: CSCI 257 and MATH 215,NA
10430,CSCI,428,A,Operating Systems,4,L Dale,MW,1300,1415,,NA,NA,Woods Laboratories 136,15,3,Available: 12,Prerequisites: CSCI 270 and MATH 215,NA
Earth & Environmental Systems,,NA,,,,,,NA,NA,,NA,NA,,NA,NA,,,NA
10518,FORS,121,A,Introduction to Forestry (Lab),4,S Torreano,TR,930,1045,R,1330,1630,Snowden Hall 211,20,22,Closed,Lab Science,NA
10519,FORS,201,A,Natural Resources Issues and Policies,4,K Smith,MWF,1000,1050,,NA,NA,Snowden Hall 211,18,21,Closed,Waitlist - contact instructor,NA
10520,FORS,230,A,Urban Forest Management,4,K Kuers,TR,1100,1215,,NA,NA,Snowden Hall 211,24,14,Available: 10,Non-Lab Science; Prerequisite: FORS 121,NA
10521,FORS,312,A,Silviculture (Lab),4,K Kuers/S Torreano,MWF,900,950,M,1330,1630,Snowden Hall 211,20,11,Available: 9,Lab Science; Prerequisite: FORS 121,NA
10522,FORS,314,A,Hydrology (Lab),4,M Knoll,TR,930,1045,T,1330,1630,Snowden Hall 209,24,20,Available: 4,Lab Science; Prerequisite: GEOL 121,NA
10523,FORS,432,A,Senior Field Project,2,M Knoll,MWF,1200,1250,F,1330,1630,Snowden Hall 209,30,20,Available: 10,Open only to seniors pursuing majors in forestry, geology, natural resources, or natural resources and the environment; Western Field Trip Fee: $50,NA
10524,GEOL,121,A,Physical Geology (Lab),4,M Knoll,TR,1100,1215,R,1330,1630,Snowden Hall 209,24,28,Closed,Lab Science,NA
10525,GEOL,121,B,Physical Geology (Lab),4,S Shaver,MWF,1100,1150,M,1330,1630,Snowden Hall 102,20,19,Available: 1,Lab Science,NA
10526,GEOL,215,A,Economic Geological Resources (Lab),4,S Shaver,TR,1100,1215,R,1330,1630,Snowden Hall 102,15,16,Closed,Lab Science; Open only to juniors and seniors; Prerequisite: GEOL 121,NA
10527,GEOL,314,A,Hydrology (Lab),4,M Knoll,TR,930,1045,T,1330,1630,Snowden Hall 209,24,20,Available: 4,Lab Science; Prerequisite: GEOL 121,NA
10528,GEOL,325,A,Field and Structural Geology (Lab),4,B Potter,MWF,1100,1150,W,1330,1630,Snowden Hall 209,20,9,Available: 11,Lab Science; Prerequisite: GEOL 121,NA
10529,GEOL,432,A,Senior Field Project,2,M Knoll,MWF,1200,1250,F,1330,1630,Snowden Hall 209,30,20,Available: 10,Open only to seniors pursuing majors in forestry, geology, natural resources, or natural resources and the environment; Western Field Trip Fee: $50,NA
Economics,,NA,,,,,,NA,NA,,NA,NA,,NA,NA,,,NA
10532,ECON,101,A,Introduction to Economics,4,D Williams,MW,1100,1215,,NA,NA,Walsh-Ellett Hall 306,20,21,Closed,,NA
10533,ECON,101,B,Introduction to Economics,4,D Williams,TR,1100,1215,,NA,NA,Walsh-Ellett Hall 308,20,22,Closed,Reserved Seats: returning freshmen-5 (none available),NA
10537,ECON,101,C,Introduction to Economics,4,J Bradbury,TR,800,915,,NA,NA,Woods Laboratories 230,20,20,Closed,Reserved Seats: returning freshmen-5 (none available),NA
10540,ECON,101,D,Introduction to Economics,4,R Gottfried,TR,930,1045,,NA,NA,Walsh-Ellett Hall 304,20,18,Available: 2,Reserved Seats: returning freshmen-5 (1 available),NA
10542,ECON,101,E,Introduction to Economics,4,G Dempster,MW,930,1045,,NA,NA,Walsh-Ellett Hall 310,20,17,Available: 3,Reserved Seats: returning freshmen-5 (none available),NA
10715,ECON,216,A,Fundamentals of Managerial Accounting,4,C Heinemann,MW,1600,1730,,NA,NA,Walsh-Ellett Hall 308,15,17,Closed,Prerequisite: ECON 215,NA
10543,ECON,301,A,Money and Banking,4,G Dempster,MW,800,915,,NA,NA,Walsh-Ellett Hall 310,25,24,Available: 1,Prerequisite: ECON 101,NA
10544,ECON,301,B,Money and Banking,4,G Dempster,MW,1200,1315,,NA,NA,Walsh-Ellett Hall 310,25,25,Closed,Prerequisite: ECON 101,NA
10534,ECON,306,A,Macroeconomic Theory,4,Y Mohiuddin,TR,930,1045,,NA,NA,Walsh-Ellett Hall 310,15,19,Closed,Prerequisite: ECON 101,NA
10535,ECON,306,B,Macroeconomic Theory,4,Y Mohiuddin,TR,1100,1215,,NA,NA,Walsh-Ellett Hall 310,15,20,Closed,Prerequisite: ECON 101,NA
10536,ECON,309,A,Women in the Economy,4,Y Mohiuddin,R,1400,1630,,NA,NA,Walsh-Ellett Hall 306,20,20,Closed,Writing Intensive; Prerequisite: ECON 101,NA
10539,ECON,331,A,Public Finance and Fiscal Policy,4,J Bradbury,TR,930,1045,,NA,NA,Woods Laboratories 113,20,20,Closed,Prerequisite: ECON 101,NA
10538,ECON,333,A,Econometrics,4,J Bradbury,MW,1245,1400,,NA,NA,duPont Library G10,15,20,Closed,Prerequisites: ECON 101 and (STAT 204 or ECON 201),NA
10531,ECON,380,A,Seminar in the Economics of Rural Development in the United States,4,R Gottfried,MW,1415,1530,,NA,NA,Woods Laboratories 103,15,15,Closed,Prerequisite: ECON 101,NA
10541,ECON,381,A,The Political Economy of Sustainable Development,4,R Gottfried,MW,1100,1215,,NA,NA,Walsh-Ellett Hall 312,15,16,Closed,Prerequisite: ECON 101,NA
Education,,NA,,,,,,NA,NA,,NA,NA,,NA,NA,,,NA
10304,EDUC,161,A,Introduction to Educational Psychology,4,M Wallace,TR,930,1045,,NA,NA,Woods Laboratories 340,13,19,Closed,Reserved Seats: seniors-4 (none available), juniors-2 (none available), sophomores-3 (none available), returning freshmen-4 (none available); Waitlist - contact instructor; School visits in addition to class time.,NA
10305,EDUC,161,B,Introduction to Educational Psychology,4,M Wallace,TR,1100,1215,,NA,NA,Woods Laboratories 340,17,18,Closed,Reserved Seats: seniors-6 (none available), juniors-3 (none available), sophomores-4 (none available), returning freshmen-4 (none available); Waitlist - contact instructor; School visits in addition to class time.,NA
10306,EDUC,201,A,Instructional Technology: Digital Literacy and Learning,4,V Sells,MW,1400,1600,,NA,NA,duPont Library G31,12,11,Available: 1,,NA
10690,EDUC,255,A,Introduction to Special Education,4,H Bateman,TR,800,915,,NA,NA,Woods Laboratories 341,20,11,Available: 9,Prerequisite: EDUC 161; School visits in addition to class time,NA
10307,EDUC,279,A,History of American Education,4,W Register,MW,1100,1215,,NA,NA,St. Luke's 214,20,23,Closed,,NA
10707,EDUC,342,A,Student Teaching,8,E Meliza,MTWRF,800,1500,,NA,NA,TBA,10,2,Available: 8,Open only to seniors; Prerequisite: EDUC 341; Corequisite: EDUC 342; Co-req with Educ 401,NA
10309,EDUC,343,A,Methods and Materials for Teaching Art,4,E Carlos,W,1300,1700,,NA,NA,Carnegie Hall 201,10,6,Available: 4,Prerequisite: ART 151; School visits during class time.,NA
10310,EDUC,401,A,Senior Seminar,4,E Meliza,T,1600,1830,,NA,NA,TBA,10,2,Available: 8,Open only to seniors; Corequisite: EDUC 401; Co-req with Educ 342,NA
English,,NA,,,,,,NA,NA,,NA,NA,,NA,NA,,,NA
10584,ENGL,101,A,Literature and Composition,4,B Engel,MWF,800,850,,NA,NA,St. Luke's 204,15,14,Available: 1,Writing Intensive,NA
10585,ENGL,101,B,Literature and Composition,4,J Reishman,MWF,800,850,,NA,NA,Guerry Hall 1,15,15,Closed,Writing Intensive,NA
10586,ENGL,101,C,Literature and Composition,4,J Grammer,MWF,900,950,,NA,NA,St. Luke's 112,15,15,Closed,Writing Intensive,NA
10587,ENGL,101,D,Literature and Composition,4,K Malone,MWF,1200,1250,,NA,NA,St. Luke's 204,15,16,Closed,Writing Intensive; Waitlist - contact instructor,NA
10588,ENGL,101,E,Literature and Composition,4,E Grammer,TR,800,915,,NA,NA,St. Luke's 202,15,13,Available: 2,Writing Intensive,NA
10589,ENGL,101,F,Literature and Composition,4,V Craighill,TR,930,1045,,NA,NA,St. Luke's 204,15,14,Available: 1,Writing Intensive; Waitlist - contact instructor,NA
10590,ENGL,101,G,Literature and Composition,4,V Craighill,TR,1100,1215,,NA,NA,St. Luke's 210,15,15,Closed,Writing Intensive; Waitlist - contact instructor,NA
10591,ENGL,200,A,Representative Masterpieces,4,B Benson,MWF,900,950,,NA,NA,Walsh-Ellett Hall 206,20,17,Available: 3,Prerequisites: ENGL 101 or (HUMN 101 and HUMN 102),NA
10592,ENGL,200,B,Representative Masterpieces,4,T Carlson,MF,1100,1215,,NA,NA,duPont Library 215,15,13,Available: 2,Writing Intensive; Prerequisites: ENGL 101 or (HUMN 101 and HUMN 102),NA
10593,ENGL,200,C,Representative Masterpieces,4,J Reishman,TR,930,1045,,NA,NA,Guerry Hall 1,20,20,Closed,Prerequisites: ENGL 101 or (HUMN 101 and HUMN 102),NA
10594,ENGL,210,A,Studies in Poetry,4,J Michael,TR,800,915,,NA,NA,St. Luke's 204,15,10,Available: 5,Writing Intensive; Prerequisites: ENGL 101 or (HUMN 101 and HUMN 102),NA
10595,ENGL,211,A,Studies in Fiction,4,B Clarkson,TR,1100,1215,,NA,NA,St. Luke's 204,25,25,Closed,Prerequisites: ENGL 101 or (HUMN 101 and HUMN 102),NA
10787,ENGL,216,A,Studies in Literature: American Literary Journalism,4,V Craighill,MWF,1000,1050,,NA,NA,St. Luke's 204,20,20,Closed,,NA
10788,ENGL,218,A,Studies in Literature: Literature and Religion,4,J Gatta,MWF,1000,1050,,NA,NA,Walsh-Ellett Hall 208,25,8,Available: 17,,NA
10598,ENGL,351,A,Non-Chaucerian Medieval Literature,4,B Benson,TR,930,1045,,NA,NA,Walsh-Ellett Hall 206,25,18,Available: 7,,NA
10599,ENGL,352,A,Chaucer,4,B Benson,MWF,1100,1150,,NA,NA,Walsh-Ellett Hall 206,25,18,Available: 7,,NA
